{
  "schemaVersion": "bridge-mailbox-v2",
  "kind": "ready",
  "objectKind": "message",
  "objectId": "mailbox.message.11111111-1111-4111-8111-111111111111",
  "sha256": "aaaaaaaaaaaaaaaaaaaaaaaaaaaaaaaaaaaaaaaaaaaaaaaaaaaaaaaaaaaaaaaa",
  "byteLength": 900,
  "createdAt": "2026-07-14T12:00:00.000Z"
}
